{
    "description": "IEC 61360-4 - IEC/SC 3D - Common Data Dictionary (CDD- V2.0015.0002) - PROPERTY_TSTM-CFMNL9",
    "guid": "57fe623e-3689-4929-9cb4-ea859a9de472",
    "mapType": "spreadsheet",
    "datasheetDescLocation" : {
        "sheetName" : "Export",
        "row" : 12,
        "col" : "A"
    },
    "sheets": [
        {
            "sheetName": "Export",
            "includeInDatasheet" : true,
            "ignoreBlanks" : true,
            "ignoreRows" : [
                
            ],
            "ignoreCols" : [
               
            ],
            "sections" : [ 
                {
                    "indexOn" : {
                        "orientation" : "column",
                        "header" : {
                            "row" : 24,
                            "col" : "B"
                        },
                        "dataStartRow" : 38,
                        "maxRows" : 50
                    },
                    "fieldHeaders" : {
                                "row" : 24                                       
                    },
                    "spans" : {
                        "columns" : [
                            "C",
                            "D",
                            "E",
                            "F",
                            "G",
                            "H",
                            "I",
                            "J",
                            "K",
                            "L",
                            "M",
                            "N",
                            "O",
                            "P",
                            "Q",
                            "R",
                            "S",
                            "T",
                            "U",
                            "V",
                            "W",
                            "X",
                            "Y",
                            "Z",
                            "AA",
                            "AB",
                            "AC",
                            "AD",
                            "AE",
                            "AF",
                            "AG",
                            "AH",
                            "AI",
                            "AK"
                        ]
                    }
                }               
            ]
       }        
    ]
}